{
  "initial_topic": "Robustness metric tuning for multi-step systems",
  "major_pivots": [
    "From local metric tuning to mechanism-indexed evaluation framework"
  ],
  "rejected_ideas": [
    {
      "idea": "Simple benchmark extension",
      "reason": "High incremental risk and weak abstraction leverage"
    }
  ],
  "successful_reframing": [
    "Metric mismatch -> construct validity object"
  ],
  "claim_rewrites": [
    "first-ever metric -> broader-setting diagnostic advantage"
  ],
  "sources_that_changed_judgment": [
    "Official protocol specification",
    "Cross-domain benchmark standard"
  ],
  "workflow_failures": [
    "Reviewer-style attack simulation happened too late"
  ],
  "system_improvement_suggestions": [
    "Run novelty prosecutor before final route selection"
  ]
}
